{
  "schemaVersion": "muse.paired-source.v1",
  "id": "synthetic-motif",
  "title": "Synthetic motif fixture",
  "midi": { "path": "fixtures/tonemap/synthetic/motif-theme.mid", "origin": "transcription" },
  "audio": { "path": "fixtures/tonemap/synthetic/motif-theme.wav", "format": "wav", "sampleRate": 22050, "channels": 1 },
  "relationship": { "sameArrangement": true, "sameTempo": true, "sameLength": true, "knownOffsetMs": null },
  "rights": { "publiclyRedistributable": true, "analysisAllowedLocally": true, "note": "synthetic fixture generated by MUSE, free to redistribute" }
}
